{
  "user_setup_id": "",
  "applicant_id": "",
  "workflow_mode": "full_shortlist",
  "output_mode": "draft",
  "recommendation_count": 10,
  "preferred_depth": "standard",
  "ask_style": "compact_batches",
  "source_policy": "official_only",
  "privacy_mode": "public_redacted",
  "export_format": "table",
  "profile": {
    "target_degree_level": "",
    "target_intake": "",
    "target_countries": [],
    "citizenship_countries": [],
    "residence_country": "",
    "education_country": "",
    "passport_country": "",
    "target_field": "",
    "gpa_value": "",
    "gpa_scale": "",
    "budget_annual": "",
    "language_status": ""
  },
  "evidence_records": []
}
